<?xml version="1.0" encoding="UTF-8"?>
<tns:GameSettings xmlns:tns="http://www.example.org/dune" xmlns:xsi="http://www.w3.org/2001/XMLSchema-instance" xsi:schemaLocation="http://www.example.org/dune dune.xsd ">
  <tns:UnitsData>
    <tns:UnitData>
      <tns:Name>tns:Name</tns:Name>
      <tns:BaseType>tns:BaseType</tns:BaseType>
      <tns:Cost>tns:Cost</tns:Cost>
      <tns:FireRange>tns:FireRange</tns:FireRange>
      <tns:Speed>tns:Speed</tns:Speed>
      <tns:ReloadTime>tns:ReloadTime</tns:ReloadTime>
      <tns:AmmoType>tns:AmmoType</tns:AmmoType>
      <tns:Health>tns:Health</tns:Health>
      <tns:ViewRange>tns:ViewRange</tns:ViewRange>
      <tns:Power>tns:Power</tns:Power>
      <tns:BuildSpeed>tns:BuildSpeed</tns:BuildSpeed>
      <tns:DamageDestroy>tns:DamageDestroy</tns:DamageDestroy>
      <tns:RotationSpeed>tns:RotationSpeed</tns:RotationSpeed>
      <tns:TurretRotationSpeed>tns:TurretRotationSpeed</tns:TurretRotationSpeed>
      <tns:TurretTexture>tns:TurretTexture</tns:TurretTexture>
      <tns:Texture>tns:Texture</tns:Texture>
      <tns:Picture>tns:Picture</tns:Picture>
    </tns:UnitData>
  </tns:UnitsData>
  <tns:BuildingsData>
    <tns:BuildingData>
      <tns:Name>tns:Name</tns:Name>
      <tns:Cost>tns:Cost</tns:Cost>
      <tns:FireRange>tns:FireRange</tns:FireRange>
      <tns:ReloadTime>tns:ReloadTime</tns:ReloadTime>
      <tns:Health>tns:Health</tns:Health>
      <tns:ViewRange>tns:ViewRange</tns:ViewRange>
      <tns:Power>tns:Power</tns:Power>
      <tns:BuildSpeed>tns:BuildSpeed</tns:BuildSpeed>
      <tns:Texture>tns:Texture</tns:Texture>
      <tns:Picture>tns:Picture</tns:Picture>
      <tns:Size>
        <tns:X>tns:X</tns:X>
        <tns:Y>tns:Y</tns:Y>
      </tns:Size>
      <tns:EnergyConsumption>tns:EnergyConsumption</tns:EnergyConsumption>
      <tns:RideableFields>
        <tns:int>tns:int</tns:int>
      </tns:RideableFields>
      <tns:CanProduceUnits>
        <tns:name>tns:name</tns:name>
      </tns:CanProduceUnits>
      <tns:CanProduceBuilding>
        <tns:name>tns:name</tns:name>
      </tns:CanProduceBuilding>
    </tns:BuildingData>
  </tns:BuildingsData>
</tns:GameSettings>
